漢字,読み,間違い1,間違い2,間違い3,意味。
続柄,つづきがら,ぞくがら,つながら,つづきばら,親族関係の呼び方。父・母・兄弟など、家族の間柄を表す語。
美人局,つつもたせ,びじんきょく,びじん局,みとせ,夫婦などが共謀し、妻に他の男を誘惑させ、それを言いがかりに金品を脅し取る狂言。
椿,つばき,ちん,はるのはな,とうかはな,常緑樹で冬から春に花を咲かせる。「ちん」は誤読で「つばき」が正しい。
礫,つぶて,れき,こいし,なげいし,小石・石ころ。投げる石の意味もある。「れき」は音読み。
呟く,つぶやく,げんく,つぶやき,げんくす,小声で言う。
艶やか,つややか,えんやか,なまめやか,あでやか,なめらかで光沢があり美しい様子。肌・髪・果物などに使われる。
梅雨,つゆ,ばいう,うめあめ,うめゆ,6月ごろに続く長雨の時期。「ばいう」は漢語読み、「つゆ」が日本語読み。
露,つゆ,ろ,しずく,あめつぶ,朝に草などに付く水滴。「ろ」は音読み。「したたり落ちる」意味でも使われる。
釣瓶,つるべ,つりべ,つるべ,つりびん,井戸から水を汲み上げるための、縄をつけた桶。
諦観,ていかん,あきらめかん,ちかん,たいかん,物事の本質を見通すこと、または迷いなく諦めの境地に達すること。
体裁,ていさい,たいさい,たいさい,ていざい,外から見た様子、格好、世間体。書類などのレイアウトや体裁。
丁重,ていちょう,ひのとじゅう,ていじゅう,ひのとちょう,礼儀正しく、手厚いこと。
適宜,てきぎ,てきよろしく,てきぎぎ,てきよろし,各自の判断でその場にぴったり合うように行うこと。
凸凹,でこぼこ,とつおう,とつぼこ,でこうお,表面が平らでなく出っ張りやへこみがある様子。「とつおう」は音読み。
手練,てだれ,てれん,しゅれん,てのれん,技術や経験が非常に優れていること・その人物。「てれん」は別の意味もある。
天下逸品,てんかいっぴん,てんかいつぴん,てんげいっぴん,てんかいちひん,世の中に並ぶものがないほど優れた品。
伝播,でんぱ,でんばん,つたわり,でんぱ,広く伝わり、広がっていくこと。波動や文化などが他に広まること。
天賦,てんぷ,てんもち,てんぶ,てんぶぶ,生まれつき備わっている才能など。
添付,てんぷ,てんふ,そうふ,てんつけ,付け加えること。
貼付,てんぷ,ちょうふ,はりつけ,てきふ,書類などを貼り付けること。「ちょうふ」は俗読みで、正しくは「てんぷ」。
転変,てんぺん,てんべん,ころへん,てんへん,移り変わること。
頭角,とうかく,あたまつの,ずかく,あたまかく,才能や実力が周囲よりも抜きん出ること。
等閑,とうかん,とうかんん,ひとしひま,などか,物事をいい加減に扱うこと。「なおざり」とも読む。
踏査,とうさ,ふみさ,とうしゃ,ふさ,現地調査。
踏襲,とうしゅう,ふしゅう,とうしょう,ふとう,前例を受け継ぐこと。
淘汰,とうた,たいた,あらいた,たいだ,良いものを残し、不要なものを排除すること。
唐突,とうとつ,からとつ,とうつき,からつき,前触れもなく急で、不意であること。
踏破,とうは,ふみは,とうば,ふは,歩いて制覇すること。
逃避,とうひ,にげひ,とうし,のがれひ,現実や困難から逃げること。「現実逃避」「逃避行動」などの形で使われる。
答弁,とうべん,こたえべん,とうべつ,こたえべつ,質問に対して返答や説明をすること。
度外視,どがいし,たびがいし,どそとし,たびそとし,全く問題にしないこと。
読経,どきょう,よみきょう,とっきょう,どうきょう,お経を声に出して読むこと。「よみきょう」は誤読で「どきょう」が正しい。
読破,どくは,よみやぶり,どくぱ,よみは,本を最後まですべて読み切ること。
土壇場,どたんば,つちだんば,どだんば,つちたんば,決断を迫られる最後の場面。
突風,とっぷう,つきかぜ,とつふう,つきぷう,急に激しく吹く風。
兎も角,ともかく,うさぎかく,とりあえず,ともかど,それはさておき・いずれにせよという意味。「兎も角、まずやってみよう」などの形で使われる。
蜻蛉,とんぼ,せいれい,とんぼう,せいろう,昆虫の一種。また「かげろう」とも読む。「せいれい」は誤読。
貪欲,どんよく,たんよく,むさぼりよく,どんにん,飽くことなく欲しがること。非常に強い欲求・欲望の強さを表す。
内省,ないせい,ないしょう,うちかえりみ,うちせい,自分の考えや行動を深く反省すること。
内包,ないほう,うちづつみ,ないぽう,ないよう,含み持つこと。
凪,なぎ,てい,かぜなし,しずかうみ,風がやんで波が静まった状態。「てい」は誤読で「なぎ」が正しい。
仲人,なこうど,なかにん,ちゅうじん,なかびと,結婚の仲介をする人。「ちゅうじん」は誤読で「なこうど」が正しい。
名残,なごり,みょうさん,なのこり,なごろ,別れの名残・物事が終わった後に残る余韻。「みょうさん」は誤読。
名代,なだい,みょうだい,めいだい,なだい,評判が高いこと、有名であること。または代理人のこと。※画像「名代(の店)」は「なだい」。
雪崩,なだれ,ゆきくずれ,せつほう,ゆきなだ,山の斜面に積もった雪が崩れ落ちる現象。「ゆきくずれ」は誤読で「なだれ」が正しい。
捺印,なついん,おしいん,なつし,さついん,書類に印鑑を押すこと。「押印」と同じ意味。「なついん」が正しい読み。
何卒,なにとぞ,なにそつ,どうか,なんとぞ,どうか・ぜひともという意味の丁寧な依頼表現。手紙文などでよく使われる。
難解,なんかい,だんかい,なんげ,なんけ,理解しにくいこと。
難儀,なんぎ,だんぎ,なんぎょう,なんき,苦労すること。
難詰,なんきつ,むずきつ,なんづめ,むずづめ,欠点を厳しくなじること。
難航,なんこう,だんこう,なんごう,なんぎょう,順調に進まないこと。
難渋,なんじゅう,なんしぶ,なんじゅ,だんじゅう,苦労すること。
難色,なんしょく,なんいろ,だんしょく,なんじき,気が進まない様子。
難読,なんどく,だんどく,なんよみ,なんとく,読みにくいこと。
肉汁,にくじゅう,にくじる,にくしる,にくじゅ,肉を調理したときに出る、旨味を含んだ汁。
日常生活,にちじょうせいかつ,ひびじょうせいかつ,にちじょういき,ひびじょういき,普段の毎日の暮らし。
如実,にょじつ,じょじつ,ごとじつ,にょじつ,実際の通りであること、ありのまま、生き生きとしている様子。
強請る,ねだる,きょうせいする,ごうせいする,つよしる,せがむこと。
捏造,ねつぞう,でつぞう,こねつぞう,ねつくり,実際にないことを事実のように作り上げること。「記事を捏造する」などの形で使われる。
粘着,ねんちゃく,ねばちゃく,ねんちゅう,ねばちゅう,ぴったりとくっついて離れないこと。
年俸,ねんぽう,ねんぼう,としほう,ねんぽく,1年を単位として支給される給与や報酬の額。
能弁,のうべん,のうべつ,あたべん,あたべつ,言葉巧みに、しゃべるのが上手なこと。
鑿,のみ,さく,ほりどうぐ,きりき,木や石を彫る工具。「さく」は音読みで「のみ」が正しい。
海苔,のり,かいたい,うみくさ,うみのり,食用の藻類を干したもの。「かいたい」は誤読で「のり」が正しい。
暖簾,のれん,だんれん,あたためとばり,おんとばり,商店の入口に垂らす布製の仕切り。「だんれん」は誤読で「のれん」が正しい。
暢気,のんき,ちょうき,のびき,ゆっくり,細かいことを気にせず、おっとりとしている様子。「暢気者」「暢気な性格」の形で使われる。
把握,はあく,はにぎり,ばあく,はわく,しっかり理解すること。
把握力,はあくりょく,ばあくりょく,はわくりょく,はにぎりりょく,理解する力。
拝見,はいけん,はいみ,おがみけん,はいげん,見ることの謙譲語。
拝読,はいどく,はいよみ,おがみどく,はいとく,読むことの謙譲語。
破格,はかく,やぶかく,はかくく,やぶかくく,一般的・標準的な基準を大きく外れて格別なこと。
波及,はきゅう,なみきゅう,はきう,なみきう,影響がだんだんと周囲に広がっていくこと。
博学,はくがく,ばくがく,ひろがく,はっがく,広い分野の知識を持っていること。
博識,はくしき,ひろしき,ばくしき,はっしき,幅広い知識をたくさん持っていること。
箸,はし,ちょ,たべもの,しょくじき,食事に使う細長い棒状の道具。「ちょ」は音読みで「はし」が正しい。
把持,はじ,はもち,ばじ,はし,しっかり持つこと。
破綻,はたん,はじょう,やぶれたん,はじれつ,計画や事業などが行き詰まり、うまくいかなくなること。
蜂,はち,ほう,さしむし,とびむし,毒針を持つ昆虫の一種。「ほう」は音読みで「はち」が正しい。
抜群,ばつぐん,ぬきぐん,ばっぐん,ぬきむら,周囲と比べて特に優れていること。
跋扈,ばっこ,はびこり,ばつこ,はっこ,勢力を張って思うままに振る舞うこと。「悪がはびこる」の意味で使われる。
発祥,はっしょう,ほっしょう,はつしょう,ほしょう,物事の始まり。
発祥地,はっしょうち,ほっしょうち,はつしょうち,ほしょうち,始まりの場所。
破天荒,はてんこう,やぶてんこう,はてんあら,やぶてんあら,前人未到の偉業を成し遂げること。※豪快という意味は誤り。
波止場,はとば,なみとば,はしば,なみどば,船が停泊し荷物の積み降ろしをする所。「なみとば」は誤読で「はとば」が正しい。
憚る,はばかる,たんる,えんりょる,かたる,遠慮する・気がねすること。「人目を憚らず泣く」などの形で使われる。
波紋,はもん,なみもん,はぶん,はばん,水面に広がる同心円状の波。また、社会に広がる影響を指す。
端役,はやく,たんやく,はしやく,はやく,演劇や映画などで、重要性の低い重要でない役。重要性の低い役割。
貼替,はりかえ,てんかえ,ちょうかえ,はりがえ,貼り替えること。
貼紙,はりがみ,ちょうし,てんし,はりし,貼り付けた紙。
汎化,はんか,ぼんか,はんげ,ひろか,一般化すること。
万事,ばんじ,まんじ,よろずじ,よろずこと,すべてのこと。
繁盛,はんじょう,はんせい,しげもり,はんじょうう,賑わって栄えること。
万全,ばんぜん,まんぜん,よろずぜん,ばんぜん,少しの手落ちもない、完璧で絶対に安全な様子。
繁茂,はんも,しげも,はんもお,しげもお,草木が盛んに生い茂ること。
汎用,はんよう,ぼんよう,はんゆう,ひろよう,広く使えること。
凡例,はんれい,ぼんれい,ぼんたとえ,はんたとえ,書物・地図などの使い方や記号を説明した部分。「凡例を参照」などの形で使われる。
凡例集,はんれいしゅう,ぼんれいしゅう,はんらいしゅう,ぼんらいしゅう,凡例を集めたもの。
柊,ひいらぎ,しゅう,いがき,とげき,葉に鋭いトゲを持つ常緑樹。「しゅう」は誤読で「ひいらぎ」が正しい。
批准,ひじゅん,ひじゅ,ひじゅんん,ひせつ,条約を最終的に確認して承認すること。
美辞麗句,びじれいく,びじうるわしく,びことれいく,うつくしことばれいく,うわべだけを美しく飾った、中身のない言葉。
直向き,ひたむき,ちょくむき,なおむき,ひたむきき,一つのことに一生懸命に向かう様子。
逼迫,ひっぱく,きんぱく,せまりはく,ひきはく,事態が差し迫って余裕がなくなること。財政・状況が追い詰められた状態。
他人事,ひとごと,たにんごと,ほかびとごと,たじんごと,自分に関係ないこと。
一入,ひとしお,いちにゅう,いちいり,ひとついり,ひときわ、いっそう。感情や状態が他と比べてより強まる様子。
一筋縄,ひとすじなわ,いちすじなわ,いちじょうなわ,ひとすじじょう,普通の手段。多くは「?ではいかない」と否定を伴う。
批難,ひなん,うつなん,ひなんん,うつなんん,人の過ちや欠点を責めること。通常は「批判」「非難」を使う。
檜,ひのき,かい,ひきのき,ひのちき,日本の代表的な針葉樹で建材として有名。「かい」は誤読で「ひのき」が正しい。
氷山の一角,ひょうざんのいっかく,こおりやまのいっかく,ひょうざんのひとつのつの,こおりやまのひとつのつの,現れている事象が、全体のほんの一部にすぎないこと。
剽窃,ひょうせつ,ぬすみせつ,ひょうたつ,びょうせつ,他人の文章・アイデアなどを盗んで自分のものとして使うこと。いわゆる「パクリ」の書き言葉。
日和,ひより,にちわ,にっわ,にちゆう,空模様・天気の具合のこと。「にちわ」は誤読で「ひより」が正しい。
頻出,ひんしゅつ,びんしゅつ,ひんで,びんで,よく現れること。
頻繁,ひんぱん,びんぱん,ひんばん,びんばん,たびたび起こること。
吹聴,ふいちょう,すいちょう,ふききく,すいきく,言いふらすこと。
俯瞰,ふかん,うかん,ふがん,ふみ,高所から見下ろすこと。
普及,ふきゅう,ふきゅうう,あまねきゅう,ふきう,広く行き渡ること。
普及啓発,ふきゅうけいはつ,ふきゅうひらきはつ,ふきうけいはつ,ふきうひらきはつ,広く行き渡らせ、理解を深めさせること。
俯仰,ふぎょう,ふこう,うぎょう,ふよう,見上げたり見下ろしたり。
河豚,ふぐ,かぶた,かわぶた,かわとん,毒を持つ海水魚の一種。「かわぶた」は誤読で「ふぐ」が正しい。
相応しい,ふさわしい,そうおうしい,あいおうしい,そうわしい,釣り合っている。
藤,ふじ,とう,のはな,むらさきのはな,紫色の花を咲かせるつる性の植物。「とう」は音読み。
不世出,ふせいしゅつ,ふよで,ぶせいしゅつ,ふせいしつ,めったに世に現れないほど優れた。
布石,ふせき,ぬのいし,ふいし,ぬのせき,将来のためにあらかじめ打っておく手回し。
敷設,ふせつ,しきせつ,しきまう,ふせつう,鉄道や電線を設置すること。
払拭,ふっしょく,はらいふく,ふっし,はらいしき,すっかり取り除くこと。「不安を払拭する」の形でよく使われる。
不貞腐れる,ふてくされる,ふていくされる,ふてぐされる,ふてくさる,不満や反抗心から投げやりな態度をとること。「ふていくされる」は誤読。
不憫,ふびん,ふびんん,かわいそう,ぶびん,哀れでかわいそうな様子。
吹雪,ふぶき,ふうゆき,すいせつ,すいゆき,激しい風に雪が吹き飛ばされる現象。「すいせつ」は誤読で「ふぶき」が正しい。
普遍,ふへん,ふべん,あまねあまね,ふへんん,すべてに共通して広く当てはまること。
普遍的,ふへんてき,ふべんてき,あまねてき,ふへんてきき,すべてのものに共通して当てはまる様子。
訃報,ふほう,とほう,ふうほう,ほふう,死亡の知らせ。
雰囲,ふんい,ふいん,あんい,ほうい,ある場所全体に漂う気配・ムード（「雰囲気」の略ではない単語として）。
雰囲気,ふんいき,ふいんき,ふんき,ふにんき,その場に漂う独特の気配・情緒。「ふいんき」は誤読として定着しているが、正しくは「ふんいき」。
分限,ぶんげん,ぶんげ,わけげん,ぶんげんん,その人の身分や財産の程度。
平穏,へいおん,たいらおん,へいおんん,たいらおんん,変わったことがなく、穏やかなこと。
平生,へいぜい,へいせい,ひらなま,へいじょう,ふだん、いつも、平素。日常の様子。
辟易,へきえき,うんざり,かへき,ひきえき,嫌になってうんざりすること。しつこさや煩わしさに手を焼く様子。
下手,へた,しもて,したて,しもで,技術が劣っていること。舞台用語では「しもて」、謙遜語では「したて」とも読む。
蔑視,べっし,さげすみし,みくだし,へいし,見下すこと・軽蔑して扱うこと。「女性蔑視」「弱者蔑視」などの形で使われる。
偏屈,へんくつ,へんほり,へんつつ,かたくつ,ひねくれていること。
偏見,へんけん,へんみ,かたよりけん,へんげん,先入観。
偏在,へんざい,へんさい,かたよざい,へんあり,偏って存在すること。
偏重,へんちょう,へんじゅう,かたよりちょう,へんしょう,一方に偏ること。
変貌,へんぼう,へんかお,へんぼうう,へんかおう,姿や様子がすっかり変わること。
片鱗,へんりん,かたりん,へんうろこ,かたうろこ,ほんの一部。
返戻,へんれい,へんもどり,へんろ,へんとう,返却すること。
放埓,ほうらつ,ほうらつつ,はなちらつ,ほうらつち,勝気で気まま、だらしないこと。
蛍,ほたる,けい,ひかりむし,ようこう,夜に発光する昆虫。「けい」は音読みで「ほたる」が正しい。
発起,ほっき,はっき,はつき,ほき,計画を起こすこと。
発足,ほっそく,はっそく,はつそく,ほつそく,組織などが始まること。
発端,ほったん,はったん,ほつたん,はつたん,物事の始まり。
勃発,ぼっぱつ,おこりはつ,ぼつはつ,おこりぱつ,事件などが急に起きること。
本懐,ほんかい,ほんけ,もとかい,ほんかいいた,本来の願いや本望。
反故,ほんご,はんこ,はんこお,ほんこ,書き損じた紙、または約束を無効にすること。「ほご」とも。
凡人,ぼんじん,はんじん,ぼんにん,ぼうじん,普通の人。
凡退,ぼんたい,はんたい,ぼんてい,ぼうたい,平凡なアウト。
凡退王,ぼんたいおう,はんたいおう,ぼんていおう,ぼうたいおう,野球の記録。
凡百,ぼんぴゃく,はんぴゃく,ぼんびゃく,ぼんひゃく,多くの平凡なもの。
凡ミス,ぼんみす,はんみす,ぼうみす,ぼんめす,単純なミス。
凡庸,ぼんよう,はんよう,ぼんゆう,ぼんようう,平凡なこと。
邁進,まいしん,ばいしん,まいしんん,ばいしんん,目標に向かってひたすら突き進むこと。
埋蔵,まいぞう,うめぞう,まぞう,まいそう,埋めて保存すること。
埋没,まいぼつ,うもつ,まいもつ,うめぼつ,埋もれること。
幕間,まくあい,まくま,まくかん,まくあい,演劇などで、一つの幕が閉じてから次の幕が開くまでの間の休憩時間。
末期,まつご,まっき,すえき,まつご,人間の死に際、最期のこと。※画像「末期(の水)」は「まつごの水」。
万寿,まんじゅ,ばんじゅ,よろずじゅ,まんじゅじゅ,長寿を祝う言葉。
満身創痍,まんしんそうい,まんしんきず,みつみそうい,まんしんそうき,体中が傷だらけ、または非難を浴びている状態。
身重,みおも,しんじゅう,みのしげ,みじゅう,女性が妊娠していること。お腹に子どもがいて体が重い状態。
未婚,みこん,びこん,みごん,みけん,結婚していないこと。
微塵,みじん,びじん,ちいさじん,びちり,非常に細かい粒・ごくわずかのこと。「びじん（美人）」とは異なる語。
未曾有,みぞう,みぞうう,みそう,いまだかつてない,いまだかつて起こったことがない珍しいこと。
未曽有,みぞう,みそうゆう,みそう,みぞゆう,今までにないこと。
脈診,みゃくしん,ばくしん,みょうしん,みゃくせん,脈を見る診察。
脈拍,みゃくはく,みゃくぱく,ばくはく,みゃくひょう,脈の回数。
脈々,みゃくみゃく,みゃくばく,ばくばく,みゃくやく,絶えず続くこと。
脈絡,みゃくらく,みゃくらく,ばくらく,みょうらく,つながり。
土産,みやげ,どさん,つちうまれ,どうさん,旅先などから持ち帰る贈り物。「どさん」は誤読で「みやげ」が正しい。
妙味,みょうみ,たえみ,みょうみい,みょうび,優れた味わいやおもしろみ。
睦月,むつき,もくつき,しんげつ,むつかつき,旧暦1月の別名。人々が打ち解け「むつびあう」月という意味。
名誉,めいよ,みょうよ,なよ,めいよお,誇りとなる良い評判。
面目,めんぼく,めんもく,めんぶつ,かおめ,世間に対する名誉や立場。「めんもく」も正解。
黙示録,もくしろく,もくじろく,もくしろく,黙示,キリスト教における、世界の終末と最後の審判を記した書物。隠された真実の開示。
目論見,もくろみ,めろんみ,もくがんけん,めのもくろみ,計画や企てのこと。
猛者,もさ,もうじゃ,たけもの,もうしゃ,武勇に優れた人、あるいは特定の分野で非常に実力や勢力がある人。
若しくは,もしくは,わかしくは,じゃくしくは,にゃくしくは,または・あるいはという意味の接続詞。法律文書などで「または」と使い分ける。
百舌,もず,ひゃくぜつ,ものまね,もうぜつ,小型の猛禽類の鳥。さまざまな鳥の声を真似ることから「百の舌」。
尤も,もっとも,ゆうも,ただし,まこと,確かにその通りという意味、または「ただし」という接続詞としても使われる。
弄ぶ,もてあそぶ,ろうぶ,いじぶ,ひねぶ,面白半分に扱うこと。人の気持ちや物を軽んじて扱う行為にも使われる。
紅葉,もみじ,こうよう,べにば,くれないは,秋に木の葉が赤や黄色に変わること。「こうよう」も正しいが木の種類としては「もみじ」。
木綿,もめん,きわた,もくめん,もくわた,綿花から作られる繊維・布地。「もくめん」は誤読で「もめん」が正しい。
諸刃の剣,もろはのつるぎ,しょはのつるぎ,もろはのけん,しょはのけん,一方では役に立つが、他方では大損害を被る危険があるもの。
野暮,やぼ,のぼ,やば,のば,洗練されておらず、融通が利かないこと。
弥生,やよい,いやおい,みつき,よもき,旧暦3月の別名。草木がいよいよ生い茂る月という意味。
遺言,ゆいごん,いごん,のこりこと,ゆいこと,死後のために言葉を残すこと。「いごん」は法的な表現。
憂鬱,ゆううつ,ゆうめつ,うれいうつ,ゆうこつ,気持ちが晴れず、ふさぎ込んでいる状態。難しい漢字だが読みもよく間違えられる。
遊興,ゆうきょう,ゆうこう,あそびきょう,ゆうきょうう,遊んで楽しむこと。
悠然,ゆうぜん,のんびりぜん,ゆっくりぜん,ゆうねん,落ち着いてゆったりとしている様子。「悠然と構える」などの形で使われる。
所以,ゆえん,しょい,しょい,ゆえ,理由、わけ、根拠。～となる理由。
行方,ゆくえ,いきかた,こうほう,ゆきがた,向かう先・所在・消息のこと。「こうほう」は誤読で「ゆくえ」が正しい。
輸出,ゆしゅつ,ゆうしゅつ,しゅしゅつ,ゆで,国外へ売ること。
輸入,ゆにゅう,ゆうにゅう,しゅにゅう,ゆいれ,国外から買うこと。
淀,よど,てん,たまりみず,ながれとまり,流れが止まって水が溜まること・地名にも使われる。「てん」は誤読で「よど」が正しい。
礼賛,らいさん,れいさん,らいさん,れいざん,素晴らしいものとして褒めたたえ、崇めること。
楽観,らっかん,がっかん,らくかん,らくがん,物事を良い方に考えること。
履修,りしゅう,ふしゅう,りしょう,りじゅう,学習課程を修めること。
慄然,りつぜん,ぶるぜん,おそれぜん,りつねん,恐怖や衝撃で体が震えるほどぞっとする様子。「慄然とする光景」などの形で使われる。
理不尽,りふじん,りふづん,わけふじん,りふしん,道理に合わないこと。
履歴,りれき,ふくれき,りりゃく,りせき,過去の記録。
輪郭,りんかく,わかく,りんがく,りんこく,外形の線。
輪唱,りんしょう,わしょう,りんそう,りんじょう,順に歌うこと。
