漢字,読み,間違い1,間違い2,間違い3,意味。
好事家,こうずか,こうじか,よきことか,こうずや,風流な事柄を好む人。物好きな人。
業腹,ごうはら,ぎょうはら,わざはら,ごうぶく,非常に腹が立つこと。
心地,ここち,しんじ,こころじ,こころち,気持ち・気分・感じのこと。「しんじ」は誤読で「ここち」が正しい。
古今東西,ここんとうざい,ふるいまことうざい,ここんひがしにし,ふるいまこひがしにし,昔から今まで、そしてあらゆる場所で。
居士,こじ,いし,きょし,いじ,在家のまま仏道に帰依した男性の称。また男性の戒名の下に付ける語。
固執,こしつ,こしゅう,こじつ,かたじつ,自分の意見や考えを頑固に守り変えないこと。「こしゅう」は誤読。
互選,ごせん,たがいせん,ごえらび,たがいえらび,特定のメンバーの中でお互いに投票して選ぶこと。
姑息,こそく,まごそく,こそくく,古い息,根本的な解決をせず、その場しのぎをすること。
木霊,こだま,きだま,もくれい,きれい,山や森で声や音が反響する現象。木に宿る精霊の意味もある。
誇張,こちょう,ほちょう,こちょうう,ほちょうう,大げさに表現すること。
極寒,ごっかん,きょっかん,ごくさむ,きょくかん,この上なく寒いこと。非常に厳しい寒さ。
殊に,ことに,しゅに,とくに,べつに,特に・とりわけという意味の副詞。「殊に優れた作品」などの形で使われる。
菰,こも,か,かやむしろ,すのこ,マコモや藁で編んだむしろ・茣蓙のこと。「か」は誤読で「こも」が正しい。
古文書,こもんじょ,こぶんしょ,ふるもんじょ,こもんしょ,古い時代の公文書や記録。
御用達,ごようたし,おようたつ,ごようつ,おようだつ,特定の人や機関に品物を納めること。「ごようたし」が正しく、「ごようたつ」は誤読として広まっている。
ご利益,ごりやく,ごりえき,お利益,ごりやく,神仏が人間に与える恵み、幸運。
御利益,ごりやく,ごりえき,おんりえき,おりえき,神仏から授かる恵みのこと。
声色,こわいろ,こえいろ,こわいろ,せいしょく,声の調子。また、他人の声の出し方を真似すること。
建立,こんりゅう,けんりつ,こんりつ,けんりゅう,寺院や堂塔を建てること。
遮る,さえぎる,しゃる,さえぎるす,しゃるす,進行や視界を途中で邪魔して止めること。
早乙女,さおとめ,はやおとめ,そうおとめ,さおとご,田植えをする若い女性のこと。また女性の名前にも使われる。
一昨昨日,さきおととい,いっさくさくじつ,さくさくじつ,ひとおととい,おとといの前の日のこと。
錯綜,さくそう,まじれそう,さくしょう,さっそう,複数の物事が入り組んで混乱すること。「情報が錯綜する」などの形で使われる。
蔑む,さげすむ,べつむ,みくだむ,いやしむ,相手を劣ったものとして見下すこと。軽蔑する・馬鹿にする意味。
雑魚,ざこ,ざつぎょ,ざっさかな,ざこさかな,小さな魚・価値の低い小物のこと。「ざつぎょ」は誤読で「ざこ」が正しい。
雑魚寝,ざこね,ざっぎょね,ざこね,じゃこね,狭い場所に多くの人が入り混じって、一つの布団などで一緒に寝ること。
漣,さざなみ,れん,さわさわなみ,こなみ,水面にそっと立つ細かい波。「れん」は音読みで「さざなみ」が正しい。
匙,さじ,し,スプーン,ひとさじ,液体や粉末をすくう道具。「じ」は音読みで「さじ」が正しい。
早急,さっきゅう,そうきゅう,はやきゅう,そっきゅう,非常に急ぐこと。「そうきゅう」も許容されているが、本来の読みは「さっきゅう」。
昨今,さっこん,きのうこん,さくこん,さきこん,近ごろ・最近のこと。「きのうこん」は誤読で「さっこん」が正しい。
刷新,さっしん,あらっしん,さつしん,あたらしん,悪い状態を改めて、まったく新しくすること。
蹉跌,さてつ,つまずきてつ,しゃてつ,さくてつ,物事がうまくいかず失敗・挫折すること。「蹉跌を経験する」などの形で使われる。
茶飯事,さはんじ,ちゃはんじ,ちゃめしごと,さはんこと,日常のありふれたこと。きわめて普通な出来事。
彷徨う,さまよう,ほうこう,うろつく,まよう,あてもなくうろうろと歩き回ること。精神的に迷い続けることも指す。
五月雨,さみだれ,ごがつあめ,さつきあめ,ごつきあめ,梅雨の時期に降り続く長雨のこと。「ごがつあめ」は誤読で「さみだれ」が正しい。
寒気,さむけ,かんき,かんぎ,さびき,体が寒く感じる感覚・悪寒。「かんき」とも読むが「悪寒」の意味では「さむけ」。
暫時,ざんじ,ぜんじ,しばらく,ざんし,しばらくの間、少しの間。わずかな時間を表す語。
斬新,ざんしん,きりしん,さんしん,ざんきん,発想や方法が非常に新鮮で独創的なこと。「斬新なアイデア」の形でよく使われる。
山積,さんせき,やまづみ,さんじゃく,やまづみみ,問題や仕事が山のようにたまっていること。
参内,さんだい,さんない,まいるうち,さんだい,宮中に参上すること。天皇に拝謁するために参内すること。
暫定,ざんてい,しばらくてい,ざんじょう,しばらくじょう,正式に決まるまで、一時的に取り決めること。
恣意,しい,じい,ほしいい,しき,自分の思うままにふるまう気まま・勝手な考え。「恣意的な判断」の形でよく使われる。
直訴,じきそ,ちょくそ,なおそ,じかそ,直接訴えること。
忸怩,じくじ,はじはじ,にくに,じゅくじ,自分の行いを恥ずかしく思う気持ち。「忸怩たる思い」の形で使われる。
時雨,しぐれ,じう,ときあめ,じさめ,晩秋から初冬にかけて降ったりやんだりする雨。「じう」は誤読で「しぐれ」が正しい。
施行,しこう,せこう,しぎょう,せぎょう,実施すること。
嗜好,しこう,たしなみこう,しこうう,たしなみこうう,好んで親しむこと。
示唆,しさ,じさ,しだ,じしゃ,それとなく示すこと。
施策,しさく,せさく,とりさく,せいさく,施す政策・手立て・対策のこと。「少子化対策の施策」などの形で使われる。
市井,しせい,しい,いちい,しせい,人が多く集まり住む所、街、世間。
舌鼓,したつづみ,したづつみ,したつづみ,したぽん,あまりの美味しさに舌を鳴らすこと。「したづつみ」は誤読・慣用。
示談,じだん,しだん,じたん,していだん,話し合いによる解決。
執行,しっこう,しゅうこう,しつこう,せっこう,実施すること。
桎梏,しっこく,てかせ,じっこく,しっかく,手枷・足枷のこと。転じて、自由を束縛するものを指す。「桎梏から解放される」などの形で使われる。
質実剛健,しつじつごうけん,しちじつごうけん,ただじつごうけん,しつじつつよたけ,飾り気がなく真面目で、心身ともにたくましいこと。
執刀,しっとう,しゅっとう,しつとう,しっとうう,手術すること。
疾病,しっぺい,しつびょう,しっびょう,しツやまい,病気のこと。疾患や患い。
執拗,しつよう,ねばりよう,じゅうよう,しつしつ,しつこく粘り強いこと。「執拗に迫る」「執拗な追及」などの形で使われる。
竹刀,しない,たけがたな,ちくとう,たけとう,剣道の稽古に使う竹製の剣。「ちくとう」は誤読で「しない」が正しい。
賜杯,しはい,ちょうはい,ためしはい,しはい,天皇や皇族などから褒美として授けられる杯。
慈悲,じひ,いつくしみ,なさけひ,じび,いつくしんで哀れみをかけること。仏教用語で、衆生を救う心を指す。
飛沫,しぶき,とびまつ,ひまつ,とびしる,液体が細かく飛び散ったもの。「ひまつ」は感染症関連で使われるが「しぶき」が本来の読み。
霜,しも,そう,こおりつゆ,しらしも,気温が下がり地表に凍りついた水分。「そう」は音読みで「しも」が正しい。
諮問,しもん,はかりもん,じもん,しかもん,専門家や機関に意見・答申を求めること。「審議会に諮問する」などの形で使われる。
杓子定規,しゃくしじょうぎ,ひしゃくしじょうぎ,しゃくしていき,ひしゃくしていき,決まりきった基準にこだわり、融通がきかないこと。
借用,しゃくよう,かりよう,しゃくもち,かりもち,物を借りること。
奢侈,しゃし,おごり,しゃしし,おごりもの,必要以上に贅沢をすること。
趣意書,しゅいしょ,しゅみしょ,しゅういしょ,しゅじしょ,目的説明文。
収穫,しゅうかく,しゅうがく,しゅかく,しゅうこく,取り入れ。
収監,しゅうかん,しゅうけん,しゅうがん,しゅかん,刑務所に入れること。
収拾,しゅうしゅう,しゅうじゅう,しゅうひろい,しゅしゅう,まとめること。
収奪,しゅうだつ,しゅうだち,しゅうとつ,しゅうだっ,奪い取ること。
蹂躙,じゅうりん,ふみにじり,ぞうりん,じゅうにん,踏みにじること。人権や規則などを無視して踏みにじる行為。
収斂,しゅうれん,しゅうせん,しゅうかん,しゅうりん,集まること。
主客,しゅかく,しゅきゃく,おもきゃく,しゅかくう,主人と客、または主なものと従属するもの。
宿痾,しゅくあ,やどあ,しゅくお,やどお,長年治らないでいる重い病気。
趣向,しゅこう,しこう,しゅごう,しゅきょう,工夫や趣味。
趣旨,しゅし,しゅうし,しゅじ,しゅいし,主な内容。
数珠,じゅず,すうじゅ,かずたま,すうしゅ,仏具の一種で、小さな玉を糸で繋いだもの。「すうじゅ」は誤読で「じゅず」が正しい。
受諾,じゅだく,じゅたく,うけだく,じゅらく,受け入れること。
出生,しゅっしょう,でうまれ,しゅっせい,でしょう,生まれること・生まれ。戸籍用語としては「しゅっしょう」が正式。
出生率,しゅっしょうりつ,しゅっせいりつ,しゅつしょうりつ,しゅっしょうそつ,生まれる割合。
趣味,しゅみ,しゅうみ,しゅび,しゅうび,好み。
受理,じゅり,じゅうり,うけり,じゅれい,受け付けること。
受領,じゅりょう,じゅうりょう,うけりょう,じゅれい,受け取ること。
遵守,じゅんしゅ,そんしゅ,じゅんまもる,ずんしゅ,法律・規則・命令などをよく守ること。「法令遵守」の形で使われる。
逡巡,しゅんじゅん,ためらい,じゅんしゅん,せんじゅん,決断できずにためらうこと。「逡巡して一歩が踏み出せない」などの形で使われる。
上意下達,じょういかたつ,げだつ,じょういげたつ,じょういかだつ,上の者の意思や命令を、下の者へ確実に伝えること。
正気,しょうき,せいき,ただき,まさき,確かな意識。
消却,しょうきゃく,しょうしゃく,しょうけつ,けしょう,帳簿から除くこと。
成就,じょうじゅ,せいじゅ,じょうしゅう,せいしゅう,願いや望みが叶うこと。
頌春,しょうしゅん,こうしゅん,ほめはる,しょうはる,新年を褒めたたえ、祝うこと。年賀状の賀詞。
精進,しょうじん,せいしん,しょうしん,せいじん,一つの物事に精神を集中して励むこと。肉食を断ち身を清めること。
上手,じょうず,かみて,うえて,うわて,技術がすぐれていること。舞台用語では「かみて」と読む場合もある多読み語。
定石,じょうせき,ていせき,さだいし,ていいし,囲碁の決まった打ち方、または物事の定番の方法。
承諾,しょうだく,しょうらく,じょうだく,しょうとく,同意すること。
招聘,しょうへい,しょうせい,まねい,しょうへき,礼を尽くして人を招くこと。専門家や著名人を正式に招待する際に使う。
正味,しょうみ,せいみ,ただみ,まさみ,外袋などを除いた、中身だけの実際の量や価値。
消耗,しょうもう,しょうこう,しょうひ,けしもう,使って減らすこと、また体力や気力が尽きること。「しょうこう」は誤読。
従容,しょうよう,じゅうよう,したがいよう,じゅうようう,ゆったりと落ち着いていて慌てない様子。
性悪,しょうわる,せいあく,さがわる,しょうあく,性質や性格が悪いこと。ひねくれていること。
贖罪,しょくざい,かうざい,ぞくざい,しょくつみ,自分の犯した罪や過ちをつぐなうこと。キリスト教的文脈でも使われる語。
白髪,しらが,はくはつ,しろかみ,しろがみ,色素が抜けた白い髪の毛。「しらが」が和語の読み、「はくはつ」は漢語読み。
私利私欲,しりしよく,わたくしりわたくしよう,しりしよくく,わたくしりわたくしよく,自分の利益や欲望だけを追求すること。
素人,しろうと,そじん,すひと,しろひと,その道の専門でない人・未経験者。「そじん」は誤読で「しろうと」が正しい。
師走,しわす,しそう,しばしり,しうす,旧暦12月・現代では12月の別名。僧侶が東西に走り回るほど忙しい月という説がある。
親見,しんけん,おやみ,しんみ,おやけん,自分の目で実際に確かめること。
進言,しんげん,すすみげん,しんごん,しんけん,意見を述べること。
深謝,しんしゃ,ふかしゃ,しんしゃしゃ,ふかしゃしゃ,深く感謝すること、または深く謝罪すること。
新進気鋭,しんしんきえい,しんしんきぜつ,あたらしんきえい,しんしんけいえい,ある分野に新しく登場し、勢いが盛んなこと。
進退維谷まる,しんたいいきわまる,しんたいいこくまる,しんたいいやまる,しんたいいたにまる,どうにも動きが取れなくなること。
進捗,しんちょく,しんぽ,しんはか,しんちょ,物事が進みはかどること。仕事の「進捗状況」などの形で使われる。
進呈,しんてい,しんてつ,すすみてい,しんじょう,贈ること。
推敲,すいこう,おしこう,すいこうう,おしたたき,文章を何度も練り直すこと。
出納,すいとう,でのう,しゅつのう,でいれ,金銭や物品の出し入れ・収支の管理のこと。会計用語として使われる。
数奇,すうき,すうきき,かずき,かずきき,運命のめぐり合わせが波乱万丈であること。
清々しい,すがすがしい,きよきよしい,さわやか,すがすがしい,さわやかで気持ちが良い、汚れがなく心地よい様子。
数寄屋,すきや,すうきや,かずきや,すきや,茶室風に造った建物、風流な意匠の家。
頗る,すこぶる,はなはだ,たいへん,さかんに,非常に・とても・極めてという意味の副詞。「頗る優秀な人材」などの形で使われる。
即ち,すなわち,そくち,つまり,ただち,言い換えれば・つまり・その場でという意味。接続詞として広く使われる。
寸暇,すんか,そんか,すんげ,すんが,わずかな空き時間。
寸評,すんぴょう,そんぴょう,すんびょう,すんひょう,短い評価。
正確,せいかく,しょうかく,まさかく,せいかくう,間違いがないこと。
逝去,せいきょ,いきょ,せいき,せいきょく,他人が他界すること、死ぬことの尊敬語。他人の死を敬って言う表現。
清拭,せいしき,せいしょく,きよぶき,せいしき,病気などで入浴できない人の体を、温かいタオルなどで拭いて清潔にすること。
脆弱,ぜいじゃく,きじゃく,もろじゃく,ぜいよわ,もろくて弱いこと。システムや体制の弱点を指す際にも使われる。
脆弱性,ぜいじゃくせい,きしゃくせい,よわじゃくせい,ぜいじゃくしょう,コンピュータ等の安全上の欠陥、またはもろさ。
精緻,せいち,せいちゅう,くわしち,せいじ,細部まで細かく精密なこと。非常に細かく丁寧に作られた様子を表す。
赤裸々,せきらら,あからら,あか裸々,せきはだか,包み隠さず、すべてをありのままにすること。
折檻,せっかん,おりかん,せつかん,せっけん,厳しく叱ること。
殺生,せっしょう,せっせい,ころし,さつしょう,生き物を殺すこと。または、むごいこと、気の毒なこと。
折衷,せっちゅう,おりちゅう,せつちゅう,せっこう,双方を取り入れること。
刹那,せつな,さつな,しゃとな,くさり,非常に短い瞬間・時間。「刹那的な喜び」などの形で使われる。仏教語が語源。
折半,せっぱん,おらはん,せつはん,おりはん,二等分にすること。
漸減,ぜんげん,ざんげん,ぜんかん,せんげん,少しずつ減ること。
先見の明,せんけんのめい,さきみのめい,せんけんのあきら,さきみのあきら,将来何が起こるかをあらかじめ見抜く知恵。
漸次,ぜんじ,じょじ,せんじ,ぜんつぎ,だんだんと・少しずつという意味。「漸次改善される」などの形で使われる。
漸進,ぜんしん,ざんしん,せんしん,ぜんじん,少しずつ進むこと。
漸増,ぜんぞう,ざんぞう,ぜんそう,せんぞう,少しずつ増えること。
全幅,ぜんぷく,ぜんはば,ぜんぱく,まったくはば,あらゆる限りの、すべての。「全幅の信頼」などと使う。
洗礼,せんれい,あらいれい,せんらい,せんれつ,キリスト教の入信儀式、または最初の試練。
相応,そうおう,あいおう,そうおうう,あいおうう,ふさわしいこと。
造詣,ぞうけい,ぞうし,つくりけい,つくりし,その分野の学問や技術に深い知識と理解があること。
相好,そうごう,そうこう,あいこう,あいごう,表情や顔立ちのこと。
相克,そうこく,あいこく,そうかつ,そうごく,対立すること。
相殺,そうさい,あいさつ,そうさつ,あいさい,互いの利害・損得を差し引いてゼロにすること。「あいさつ（挨拶）」とは別の語。
相乗効果,そうじょうこうか,あいのりこうか,そうじょうこうが,そうじょうか,互いに高め合う効果。
贈呈,ぞうてい,そうてい,ぞうじょう,おくりてい,贈ること。
疎外,そがい,うとがい,しょがい,そとがい,仲間外れにすること・社会や集団から切り離されること。「疎外感」などの形でよく使われる。
即席,そくせき,すぐせき,そくばしょ,すぐばしょ,その場ですぐに用意すること。
続投,ぞくとう,つづきとう,しょくとう,ぞくなげ,引き続き担当すること。
齟齬,そご,ぎょご,しょご,くいちがい,物事がうまく噛み合わず、食い違うこと。「齟齬をきたす」の形でよく使われる。
遡行,そこう,さくこう,さかのぼり,そぎょう,流れをさかのぼって行くこと。物事の過去にさかのぼって調べること。
措辞,そじ,しょじ,さじ,そうじ,言葉遣い。
措置,そち,しょち,さち,そうち,必要な処置。
措置法,そちほう,しょちほう,そうちほう,さちほう,特別法。
措定,そてい,しょてい,そうてい,さだてい,仮に定めること。
他愛ない,たあいない,たわいない,ほかあいない,たいない,とりとめがない。
対峙,たいじ,たいじじ,むかいじ,むかいじじ,向かい合ってそびえ立つこと、または対抗して睨み合うこと。
大衆,たいしゅう,だいしゅう,おおしゅう,たいしゅうう,一般の民衆。
大勢,たいせい,おおぜい,だいぜい,たいせい,物事の全体の形勢、大きな流れ。※画像「大勢(が決まる)」は「たいせい」。
代替,だいたい,だいがえ,かわりたい,だいたえ,他のものに置き換えること。「だいがえ」は誤読。正しくは「だいたい」。
大団円,だいだんえん,だいだんまる,おおだんえん,だいとえん,物語や事件などが丸く収まって終わること。「だんえん」が正しく「だんまる」は誤り。
台頭,たいとう,だいとう,だいあたま,たいず,勢力を増して、表面に現れてくること。頭角を現すこと。
代弁,だいべん,たいべん,よべん,だいへん,代わりに話すこと。
内裏,だいり,ないり,うちり,だいりい,皇居、またはお雛様の男雛と女雛。
逞しい,たくましい,ていしい,つよしい,ちからしい,体・精神が力強くしっかりしている様子。「逞しく育つ」などの形で使われる。
他山の石,たざんのいし,たやまのいし,たざんのいわ,たやまのいわ,他人の誤った言動を見て、自分の戒めとすること。
山車,だし,やまくるま,さんしゃ,やまぐるま,祭りで引き回す飾り車のこと。「やまくるま」「さんしゃ」は誤読で「だし」が正しい。
嗜む,たしなむ,しむ,このむ,うしなむ,趣味として楽しむ・適度に親しむこと。「お茶を嗜む」「嗜み」などの形で使われる。
黄昏,たそがれ,こうこん,きたそ,きこん,夕暮れ時・薄暗くなる時刻。転じて物事の衰退期を指す。「こうこん」は誤読。
七夕,たなばた,しちせき,ななゆう,なのかゆう,7月7日の行事で織姫と彦星が年に一度会う伝説に基づく。「しちせき」は音読みで「たなばた」が一般的。
煙草,たばこ,えんそう,けむりくさ,たばご,葉を乾燥させて吸う嗜好品。「えんそう」は誤読で「たばこ」が正しい。
足袋,たび,そくたい,あしぶくろ,あしたい,和装に使う布製の履物。「そくたい」は誤読で「たび」が正しい。
躊躇う,ためらう,ちゅうちょう,とまどう,まよう,決断できずに迷うこと。「躊躇なく行動する」の「躊躇」と同じ字。
耽溺,たんでき,たんじゅん,ふけでおぼれる,たんできき,ひとつのことに夢中になって溺れること。
堪能,たんのう,かんのう,たえのう,たんなう,十分に満足すること、また技芸などに非常に優れていること。
逐次,ちくじ,おいおいじ,たくじ,ちゅくじ,順を追って次々と行うこと。「逐次処理」「逐次報告」などの形で使われる。
知悉,ちしつ,ちこと,ししつ,ちしつう,知り尽くすこと。
稚拙,ちせつ,わかへた,じせつ,ちしつ,幼稚でつたないこと。技術や文章などが未熟な様子を指す。
乳離れ,ちばなれ,にゅうばなれ,ちちばなれ,にゅうりばなれ,母乳をやめること。
嫡子,ちゃくし,てきし,嫡子,ちゃくし,正妻の産んだ最初の子。家督を継ぐべき子。
紐帯,ちゅうたい,ひもたい,じゅうたい,つながりたい,人と人、国と国などをつなぐ絆・きずな。「家族の紐帯」などの形で使われる。
蝶,ちょう,てふ,ちょうちょ,ひら,鱗翅目の昆虫。古語では「てふ」と書いた。
鳥瞰,ちょうかん,とりかん,ちょうがん,とりみ,全体を見渡すこと。
鳥獣,ちょうじゅう,とりけもの,ちょうけもの,とりじゅう,鳥と獣。
手水,ちょうず,てみず,てすい,しゅすい,神仏にお参りする前に、手や口を洗い清める水。またはその行為。
長大,ちょうだい,ながおお,ちょうたい,ながたい,非常に長くて大きいこと。
彫琢,ちょうたく,ほりたく,ちょうず,ほりず,詩や文章を美しく練り上げること。
重複,ちょうふく,じゅうふく,かさふく,ちょうぼく,同じものが重なること。「じゅうふく」は慣用読みとして広まっているが、本来は「ちょうふく」。
重宝,ちょうほう,じゅうほう,しげたから,じゅほう,便利で役立つこと。
凋落,ちょうらく,しゅうらく,おちぶれ,ちょうらく,勢いが衰えて落ちぶれること。花や葉がしぼんで落ちること。
塵,ちり,じん,ほこり,こなごみ,非常に細かいほこり・ごみ。「じん」は音読み。
陳腐,ちんぷ,ちんくさ,ふるぷ,ふるくさ,古くさくて、ありふれていてつまらないこと。
追従,ついじゅう,ついしょう,おいじゅう,おいしたがう,他人の後に従うこと。「ついしょう」はへつらうこと。
月極,つきぎめ,げっきょく,つききわめ,げつぎめ,月単位の契約。
月並み,つきなみ,げつなみ,つきならび,げつならみ,平凡なこと。
